{
  "id": "unreal-engine",
  "name": "unreal-engine",
  "displayName": "Unreal Engine",
  "version": "1.0.0",
  "summary": "Drive Unreal Editor through the community Unreal MCP bridge.",
  "description": "Connect Artyx to Unreal Engine for editor automation, actors, Blueprints, level composition, and verification loops.",
  "author": {
    "name": "Artyx",
    "url": "https://artyx.ai"
  },
  "category": "games",
  "tags": ["game-engine", "editor", "blueprints"],
  "icon": "🎮",
  "license": "MIT",
  "homepage": "https://github.com/chongdashu/unreal-mcp",
  "experimental": true,
  "notes": "Server invocation follows chongdashu/unreal-mcp. If `uvx unreal-mcp` does not resolve to a published package, the user runs the server from a local clone per the upstream README and points command/args at it. Verify against upstream before removing `experimental`.",
  "mcp": {
    "transport": "stdio",
    "command": "uvx",
    "args": ["unreal-mcp"],
    "env": {
      "UNREAL_MCP_PORT": "${config.port}"
    },
    "auth": "none",
    "timeoutMs": 15000
  },
  "skills": ["skills/unreal-engine-mcp"],
  "configSchema": {
    "fields": [
      {
        "key": "port",
        "label": "Port",
        "type": "number",
        "default": 55557,
        "help": "Match the port the UnrealMCP editor plugin listens on."
      }
    ]
  },
  "companion": {
    "required": true,
    "title": "Finish setup inside Unreal Engine",
    "steps": [
      "Copy the UnrealMCP plugin into your project's Plugins/ folder.",
      "Enable it in Edit → Plugins (search 'Unreal MCP'), then restart the editor.",
      "The bridge listens on 127.0.0.1:55557."
    ],
    "docsUrl": "https://github.com/chongdashu/unreal-mcp#readme",
    "downloadUrl": "https://github.com/chongdashu/unreal-mcp",
    "prerequisites": ["Install uv / uvx — https://astral.sh/uv"]
  }
}
